{
  "version": "1.0",
  "source": "example.md",
  "author_type": "ai",
  "annotations": [
    {
      "id": "ann_ai001",
      "anchor": {
        "type": "heading",
        "heading_text": "Goals",
        "heading_level": 2
      },
      "content": "Consider adding a goal about version control integration — annotations should play well with git diffs.",
      "created_at": "2025-01-15T10:05:00Z",
      "resolved": false,
      "tags": ["suggestion"]
    }
  ]
}
