{
  "version": "1.0",
  "source": "example.md",
  "author_type": "human",
  "annotations": [
    {
      "id": "ann_sample001",
      "anchor": {
        "type": "text-range",
        "start_text": "the friction is significant",
        "end_text": "force linear interaction",
        "paragraph_index": 4
      },
      "content": "This is the key pain point we're solving. Need to emphasize this in the README.",
      "created_at": "2025-01-15T10:00:00Z",
      "updated_at": "2025-01-15T10:00:00Z",
      "resolved": false,
      "tags": ["important", "readme"]
    },
    {
      "id": "ann_sample002",
      "anchor": {
        "type": "heading",
        "heading_text": "Implementation Notes",
        "heading_level": 2
      },
      "content": "Should we add a section about conflict resolution when multiple editors annotate the same region?",
      "created_at": "2025-01-15T11:30:00Z",
      "resolved": false,
      "tags": ["question"]
    }
  ]
}
